reviewId,userName,userImage,content,score,thumbsUpCount,reviewCreatedVersion,at,replyContent,repliedAt,appVersion
ea562466-0597-457d-aa4d-b62ea1392bcf,Максим Ринчинов,https://play-lh.googleusercontent.com/a/ACg8ocJjlReaMV9XlGUjMg7CU-hQmF0V8VPSfZ9AxyEa2PgdHCLTMw=mo,Очень нехватает наличия тёмной темы в приложении,4,0,,2025-05-23 16:17:41,"Отличное предложение, спасибо! Мы очень рады, что наши пользователи заинтересованы в развитии Яндекс Разговора. Немедленного воплощения не обещаю, но мы обязательно рассмотрим эту идею.",2025-05-23 17:37:09,
a7718995-3160-42d4-a110-88fde1d0b0eb,Людмила Бокарева,https://play-lh.googleusercontent.com/a/ACg8ocKzGIEi31FT8wZSg11mswDe9M24ORtcNIsXPwUZD5grPT5fig=mo,супер,5,0,25.3,2025-05-09 11:35:41,,,25.3
cc1d78fc-9d34-4926-b8d9-3737fcc89230,Michael Dan,https://play-lh.googleusercontent.com/a-/ALV-UjU3KUpKtC2SkUXHyZBQY92O9BTtORyYrVVnRTRpirqy21Asi0yk,"очень давно надо было создать таких, а то я мучался перед глухими переводить",5,0,25.3,2025-04-23 09:27:55,,,25.3
79e8d143-84fa-4039-93a1-f0df1d92b150,Наталья,https://play-lh.googleusercontent.com/a/ACg8ocIMI0BijKHuZiR5emn6H5t4v5zRBUUmj5swzf9PO_Mjk83mYw=mo,первый раз,5,0,25.3,2025-03-20 05:03:29,,,25.3
88c75bd1-31f3-4a54-9427-1441cc227076,Любовь Кирсанова,https://play-lh.googleusercontent.com/a/ACg8ocKONB-tcD_i9ikrTxOrvVuIfbtRA32XlObkg5OWMyOeYmGyYg=mo,"Распознает речь хорошо, но почему то после паузы перестает переводить. Надо постоянно разговаривать. Или вкл и выкл. Как это исправить?",2,0,,2025-02-28 09:47:21,"Любовь, уже подхватили ваше обращение в письменной поддержке и ответили на него :)",2025-02-28 11:28:42,
2ba28601-b22b-45e1-924d-8346148f1719,Дмитрий Смирнов,https://play-lh.googleusercontent.com/a/ACg8ocKBa8Rn0iOn0L4RBzUawYHNWyNqzm3ADLBuj7vmp5-tlLVulw=mo,"Речь распознаëтся хорошо, а интонация - нет. Как я только не пытался произносить фразу, но почти всегда в конце распознавания приложение добавляет знак вопроса. Особенно, если произносишь слова типа ""когда, если, что"" и т.п. Это жутко бесит, потому что поправить это никак нельзя. А почему? Разве это так сложно, добавить возможность исправления неверно распознанного текста?",3,1,25.3,2025-02-18 03:38:18,Спасибо за желание сделать Яндекс Разговор удобнее! Обязательно рассмотрим ваше предложение о редактировании текста и постараемся улучшить распознавание интонации.,2025-02-18 04:56:23,25.3
25eda288-573d-445b-9084-b9dcdae362d3,Юлия О.,https://play-lh.googleusercontent.com/a/ACg8ocJjrynid6xbT-_5u9wHsqPwdn3YQmGCnbaZg2RPChdp2aYn3287=mo,Супер. Удобная идея! Я глухая .,5,0,25.3,2025-02-07 10:29:30,"Юлия, благодарим за высокую оценку и отзыв!",2025-02-07 11:37:36,25.3
762aec52-2869-4e32-aa18-51584f8f6d6d,Angelina “Miniako” Gren,https://play-lh.googleusercontent.com/a-/ALV-UjUgQ0s3xqfiW5iE3eqAcVW-_Nly8kbU56eKcak3PJcfYSNWV-Q,неплохо озвучивает большие текста. минусы: 1 не распознаёт другие языки. 2 разговор нельзя сохранить.,3,0,25.3,2025-02-01 20:26:33,Спасибо за желание сделать Яндекс Разговор удобнее! Обязательно рассмотрим ваши предложения.,2025-02-01 21:28:15,25.3
28a3289b-6d45-40be-ba25-90290c888a13,Хозяин,https://play-lh.googleusercontent.com/a/ACg8ocI36rlDUqEK70NBSX8YuO_3V20wKkZX9ScALvZaV5EMvpkS7A=mo,"И как вы предлагаете мне прослушать (прочитать) записанный на телефон разговор?! Дополняю: это обычный (вырезанный) голосовой ввод, тоже делает и Алиса в яКлавиатуре. А из аудиофайла не умеет распознавать голос. Как глухим слушать (читать) записанную речь?! Чат боты давно это умеют, и на много удобнее этого приложения.",1,10,25.3,2025-01-22 07:25:26,Яндекс Разговор пока что не умеет расшифровывать аудиозаписи. Спасибо за желание сделать Яндекс Разговор удобнее! Обязательно рассмотрим ваше предложение.,2025-01-22 07:57:21,25.3
28d5c52c-0c35-4d8d-aaf4-0ebc8539c91e,Галина,https://play-lh.googleusercontent.com/a/ACg8ocK3u80LQuDqT3jMaZ03Uw_IcNuOiuBB8FeW-ZxVEdTlzCp_hg=mo,Спасибо большое за помощь инвалидам . Храни Вас Бог.,5,0,,2025-01-19 18:22:19,,,
6d5be5da-c72d-4b03-bebf-8b2540b8f52d,Eleman,https://play-lh.googleusercontent.com/a-/ALV-UjXQlmSadTGvTEZ6yacW_MoqByGZuwkS7w4TmWWr77qYNhY-73hF,"Текст мелкий, много лишних телодвижений что бы начать. Сделайте максимально простое приложение со следующими вещами: программа запускается в горизонтальной ориентации, всё пространство экрана зарезервировано для текста с большим шрифтом для слабовидящих, а снизу одни единственные значки микрона и очистки текста, микрофон не должен работать постоянно, а лишь слушает когда зажимаем его(как голосовые в вацапе). И вот всё наговорённое тут же появляется на большом экране.",2,5,,2025-01-08 08:45:33,"Спасибо за предложения, мы обязательно рассмотрим ваши идеи о добавлении возможности изменения интерфейса, размера шрифта и добавлении функции регулировки кнопки микрофона.",2025-01-08 10:11:01,
7df1978d-bc4a-4fab-b0f0-28ff44157c57,Alex Kyshtymsky,https://play-lh.googleusercontent.com/a-/ALV-UjXzoHj6KdULEsM8hf3k94ik2pv2xQitJtn5lY_olnelAN9CyZcj,Не работает. Не переводит речь в текст,1,0,25.3,2025-01-04 13:23:53,"Пожалуйста, проверьте, выдано ли Разговору разрешение на использование микрофона. В настройках устройства выберите Приложения → Разговор → Разрешения. Должно быть активно разрешение на использование микрофона. Также учтите, пожалуйста, что распознавание речи будет работать только на том языке, который выбран на устройстве.",2025-01-04 15:33:18,25.3
236156ff-7bdb-4eaf-a79b-8c821326c475,Timur Rakhimov,https://play-lh.googleusercontent.com/a-/ALV-UjUv7pAFY7ngo-1pBJiPR5J_1vf1mLhZUNasgkpivi14isqssrTG,Спрунки инкредибокс,1,0,,2025-01-03 11:15:18,"Пожалуйста, расскажите, что вызвало ваше недовольство?",2025-01-03 11:52:02,
7a159956-5e50-44ad-81c0-f79b4fd6c686,Марина Владимирова,https://play-lh.googleusercontent.com/a-/ALV-UjUcbbkIX0IdvYj_hZIkjNJceqtiKPQuJN5IKnLk4pmUk6pCzxY,"Идея хорошая, но очень не хватает возможности увеличить шрифт. Даже с большим экраном текст видно только когда устройство находится вплотную и за чего полезность теряется в лутшем случае с растояния более метра уже ничего невидно, и передать cooбщение плохо слышашему человеку становится невозможно.",3,0,25.3,2024-12-16 02:05:17,"Спасибо за идею и приятные слова! Мы ценим внимание пользователей к нашему сервису и стремимся учитывать пожелания в дальнейшей работе. Возможно, именно ваше предложение поможет сделать Яндекс Разговор более удобным и функциональным.",2024-12-16 04:00:55,25.3
5d8fa405-bc0e-4fe4-a1e6-45f2c3a5500a,Андрей Приворотский,https://play-lh.googleusercontent.com/a-/ALV-UjW7Sr3HZy590hRhT62Emwp260K97iGAWYpai8UkAeOjn4vZJTrM,"Мне, как слышащему человеку, который скачивал приложение для общения со слабослышащими не хватает регулировки размера шрифта, чтобы текст сразу выводился крупно и был виден с любым зрением.",3,1,25.3,2024-12-13 16:26:08,"Спасибо за обратную связь! Мы ценим внимание пользователей к нашему сервису и стремимся учитывать пожелания в дальнейшей работе. Возможно, именно ваше предложение поможет сделать Яндекс Разговор более удобным и функциональным.",2024-12-13 17:58:43,25.3
9ccc2fad-b2d2-49f8-a36e-4e665fc7a2a4,Evgenij Novikov,https://play-lh.googleusercontent.com/a-/ALV-UjUvR5OLQGBpfbWOXNDdIMhAxuVymfMsOgmnC6U-BV3p25onc1m7,Приложение конечно работает только нет возможности увеличить шрифт распознаваемого текста. А использовать приложение всегда надевая очки - неудобно. Поэтому я выбрал другое приложение со схожим функционалом,4,0,25.3,2024-12-01 06:11:12,"Спасибо за пожелание, мы обязательно рассмотрим его!",2024-12-01 01:07:28,25.3
12ef2923-820a-43ad-a4ca-ad2b3600b847,Aleksandr Mitroshenkov,https://play-lh.googleusercontent.com/a-/ALV-UjXDAcD6jZ3qIuARnbChPaK7pxLegGTqRNuLPsVSHfBArz_4c5bN,"Это приложение могло бы стать идеальным инструментом для общения с людьми, которые плохо слышат. Однако, к сожалению, в нём нельзя настроить шрифт и фон. Нельзя сделать шрифт крупнее или, например, выбрать чёрный фон. А это позволило бы облегчить диалог, так как человеку было бы легче воспринимать информацию на экране. Сейчас же шрифт слишком мелкий, а фон белый, что не всегда удобно, особенно если нужно показать экран ночью — в таком случае телефон будет слепить яркостью.",4,2,,2024-10-12 12:18:45,"Александр, спасибо за желание сделать Яндекс Разговор удобнее! Обязательно рассмотрим ваши пожелания.",2024-10-12 16:10:31,
e5d1af44-7a92-49b7-9cae-d54bc32b2db6,Галина,https://play-lh.googleusercontent.com/a-/ALV-UjVhs6UMte3Hd-F20q6qLjjqXqNwSJtawv1kgoO2guwsSvzXZPDX,"Спасибо большое. Будьте здоровы. Забота это много значит .! Все мы смертны , и здоровым никто не умрет. 🌹Всё работает , Нас слышит , пишет , удобно, спасибо вам милый наш разработчик. Это прекрасно что о нас заботятся такие добрые люди.",5,0,25.3,2024-09-22 16:11:00,Спасибо за поддержку! Мы постараемся оправдать все ваши ожидания 😊,2024-09-22 17:30:05,25.3
e47d8a55-52cf-4e48-bf77-2f21408b2ffb,DEAF AUTO MECHANIC,https://play-lh.googleusercontent.com/a-/ALV-UjXj4k_xh-acYYUfcm2_pNdDA2nYgKJDgQL2Bn4-V8jIzMkJCAw,👍👍👍,5,0,,2024-09-22 01:42:11,,,
7a43d1c9-f785-4ab4-b873-12e745b75433,Комëр Мизробиддин,https://play-lh.googleusercontent.com/a/ACg8ocK426OChpu2_kSB3e4Ydl05bN30zhIuLt70cGeWbnNSmzlC9g=mo,Спасибо большое за поддерживаю 5 звезды 👍👍👍,5,0,25.3,2024-09-13 17:37:32,,,25.3
5f6abb51-f3fc-4de7-b940-c9a4e7ee7dd6,Александр Комаров,https://play-lh.googleusercontent.com/a/ACg8ocJ77s0QIDgT4nVsdPwji5eLG9uwWD3cBsCbyxwvkNAIkHWqPQ=mo,"Сделайте настройку размера шрифта(сдвигая и раздвигая пальцы и второй способ это удерживая на поле с текстом активировать меню и найти лупу в нëм)и фона(т.е.чëрное на белом и наоборот белое на чëрном для вечера/ночи)Кстати,вроде почти всегда верно определяет что сказано,но чтобы поправить какое-то слово в распознанном,такого нет.Можно сделать чере инструменты выделения текста. И в интерфейс кнопки настройки шрифта и фона.Т.к.зрение у пользователей можно быть разным,и время суток.+Кнопку донатов.",4,9,25.3,2024-09-09 03:43:19,"Спасибо большое за желание сделать Разговор лучше! Записали все ваши идеи, обязательно рассмотрим. Точных сроков реализации назвать не можем, но постараемся сделать всё как можно скорее!",2024-09-09 05:22:20,25.3
521dc78e-a410-4e3c-93c1-99aaa3fc258b,Татьяна,https://play-lh.googleusercontent.com/a-/ALV-UjXKh0dAA4pvFHpXSQ9mgcUths7MY9drEvokwnk3Ab0NRr2ptEaR,Это системное предустановленное дополнение из системного предустановленного Яндекс Браузер(Яндекс Старт),1,1,,2024-08-18 03:48:55,"Расскажите, пожалуйста, подробнее, какие именно сложности у вас возникли при работе с Яндекс Разговором? Можем ли мы вам как-то помочь?",2024-08-18 06:15:26,
6a559f32-ddac-4bad-9c6a-d7f603952253,Сардор Давыев,https://play-lh.googleusercontent.com/a/ACg8ocJW1IRtnivMc4QbPnghy69yBXNHYZh1_AgLOocGJUOWxt0m0kc=mo,Лэ .,4,0,25.3,2024-08-17 09:53:10,,,25.3
4a7d40f6-f121-46ef-ad7d-405f6423cdd4,Витя Кривдин,https://play-lh.googleusercontent.com/a/ACg8ocLnwZOPZ9Q_6WqehAywv9xwdYTvtQchVJg-lErtwAZ54dZQjw=mo,Нормально,3,0,25.3,2024-08-07 14:46:10,"Мы видим вашу оценку и хотим понять, что именно стало ее причиной? Расскажите, пожалуйста, подробней и мы постараемся это учесть.",2024-08-07 15:21:48,25.3
d2b88b96-a583-4cab-ac6c-dc1027a0ccf1,Адилбек Нургалиев,https://play-lh.googleusercontent.com/a-/ALV-UjVx_n_87FWc27ALIAJyT6i3DPoFELUTnEFcx48ljTadv0zzdVI,Надо переводчика язык мир,5,0,25.3,2024-08-02 06:20:10,"Спасибо за высокую оценку! Расскажите, пожалуйста, о своём пожелании подробнее, чтобы мы могли его записать :)",2024-08-02 08:39:27,25.3
d87e68b5-9ab7-47f8-878f-413d7bcaf678,Ирина Антонова,https://play-lh.googleusercontent.com/a-/ALV-UjVleLiNtqviYQlzE6nsZkACeDF5DnDLi91GKPMrWmbNDPkPIA5o,"Пока хорошо, дальше посмотрим.",5,1,,2024-08-01 03:21:50,,,
442248e6-700e-4c77-b598-2a0553a67ba4,Алёна Насупкина,https://play-lh.googleusercontent.com/a-/ALV-UjV4BMD8d_v3-Th8btRQf27uMhr--HXSyCC4UwRWxPyreZg9cCg,Удобно но не очень воспринимать диктофон,4,0,25.3,2024-06-13 03:14:32,"Пожалуйста, опишите подробнее, что именно вам не понравилось в работе с приложением? Возникают проблемы при распознавании диктофонной записи? Мы постараемся помочь.",2024-06-13 04:06:15,25.3
0df5ddf9-6e41-458d-a722-66120880ad68,Серж,https://play-lh.googleusercontent.com/a/ACg8ocL9A_b6G1boVSMRUuiek-kjWeG6aGRXwX08QZZ9jPUM_FS4Vw=mo,Что он стал Яндекс разговор глухий,5,0,,2024-04-30 08:27:31,"Высокая оценка это отлично, спасибо! Но мы не смогли понять, что вы имели ввиду. Расскажите, пожалуйста, подробней.",2024-04-30 09:14:04,
b9787b2b-b7fc-4fa2-8a01-ffbcd47db712,Stacy Spice,https://play-lh.googleusercontent.com/a-/ALV-UjUm0COXOVzVxsWRUCnuProavLhqeQqF0ycpbsvgdHw7jqjumJg,"Уважаемый разработчик, как отключить цензуру?) Я, взрослый человек, вместо того, чтоб узнать, что доподлинно мне сказали, вижу звездочки) В настройках распознавания речи цензура отключена, но приложение упорно скрывает мат. Обязательно поставлю 5 звезд, как только эта проблема решится. А так приложение очень полезное, спасибо!",3,2,25.3,2024-04-23 21:50:01,Спасибо за желание сделать Яндекс Разговор удобнее! Обязательно рассмотрим ваше предложение.,2024-04-23 22:30:30,25.3
890cf453-547d-4251-a28d-160c21e4edcf,Alika Rock's,https://play-lh.googleusercontent.com/a-/ALV-UjVvEWj43zh1D89z6k14untuRWwkPxQ8Io2sK82wPUhAp1Sw69r-ow,"Здравствуйте, это отличное начало и приложение не только для глухих, но и для тех у кого трудности с речью ♡ но пожалуйста, сделайте так чтобы можно было создавать свои папки(категории) для разных ситуаций и тем, и переносить в них свои фразы, тем самым группировать и быстрее находить)))",4,30,25.3,2024-04-17 21:42:25,"Здравствуйте! Большое спасибо за тёплые слова! Мы рады, что наше приложение пришлось вам по душе 💫 Ваша идея выглядит очень полезной. Обсудим её с командой и постараемся воплотить в жизнь в будущих обновлениях.",2024-04-18 00:34:32,25.3
ff4d3a42-3045-4ccb-a6bb-f3d817cc9b45,Carlos On,https://play-lh.googleusercontent.com/a-/ALV-UjXMMLFJBQGdvMSiJtGrwmUYJL3kETL2x1uzgQCGkwT8I8ZdiAi7,Здравствуйте нужно добавить тёмная тема и будущее ли Армении язык поддержка?,4,1,25.3,2024-04-04 09:51:02,"Здравствуйте! Спасибо за предложения! Обсудим эти идеи с разработчиками, а они подумают, можно ли их реализовать.",2024-04-04 15:00:13,25.3
49427ff4-201d-4695-a812-e0dad9ec7761,EL Doc,https://play-lh.googleusercontent.com/a/ACg8ocJh5qnyjYEoCCSxWec7yt1oD3VjfzazU9yayYWKYRsvjdzYPQ=mo,добавьте казахский язык,3,0,25.3,2024-04-02 16:34:29,"Казахский язык уже у нас есть 😉 Чтобы Яндекс Разговор корректно распознавал и синтезировал казахскую речь, в настройках телефона должен быть выбран казахский язык.",2024-04-02 21:55:56,25.3
74e58308-3476-4870-afd0-b58cd11c64aa,Ярослав «волк» Разин,https://play-lh.googleusercontent.com/a/ACg8ocK0x-NbujkYDkRDx9XgPqMfocegmvcN11ViPHMPWVsaQ1s-Aw=mo,"У меня в техникуме учатся много немых людей, а я говорю на русском языке и хочу понять их сделайте",4,0,25.3,2024-03-28 09:33:11,"Спасибо за предложение! Мы обязательно обсудим с командой, получится ли реализовать это в будущих обновлениях.",2024-03-28 13:40:11,25.3
dda33bf4-b425-4a0e-a23c-0e04621619ca,художественная отделка,https://play-lh.googleusercontent.com/a-/ALV-UjWJ1BoAiv0isaJc3NHDxf15rtPEnIp4qNXruplglh0-z5X8jy8,"Приложение не плохое только в нем мало функционала. Вот прислали мне аудио а я не могу его прослушать. а вот если бы можно было прочитать текст который там, и приложение в этом мне помогло, то это приложение было-бы отличным. А так все подобные приложения такие. Извините но ставлю 3 бала.",3,8,25.3,2024-03-22 06:49:12,"Такая возможность сейчас не предусмотрена. Мы добавим ваше предложение в список пожеланий пользователей — команде сервиса нужные стоящие идеи. Здорово, что вы поделились своими мыслями, спасибо!",2024-08-25 07:45:04,25.3
b8e31477-1a38-490b-9a81-ed2dd87af43d,Vasilisa Motsho,https://play-lh.googleusercontent.com/a-/ALV-UjVd2QozYSJkNDnItH2RlIoGzhFjNVA2V_--QcI-XsbOREZh3ybw,"Мне не нравится как работает, потому что не записывается разговор когда люди говорят, поэтому ставлю 1 звезду.",1,1,25.3,2024-03-20 09:43:33,"Пожалуйста, подробно опишите ситуацию через форму «Обратная связь»: https://yandex.ru/support/talk/support.html . Это поможет нам разобраться.",2024-03-20 10:15:15,25.3
6ba3c4a0-f3d7-4319-8474-7dc6e3c2e3fc,Анастасия Андреева,https://play-lh.googleusercontent.com/a/ACg8ocL0g4kT_-gE9JMlmVPUkPEhhpC3gqpaYW8z4dIIlT-eaINeEA=mo,"Не полностью переводит,а обрывки.",2,0,,2024-03-18 16:49:31,"Анастасия, пожалуйста, снимите небольшое видео, иллюстрирующее ваши слова, и пришлите через эту форму: https://yandex.ru/support/talk/support.html 📧 Мы очень хотим, чтобы приложение работало корректно, и рассчитываем на вашу помощь.",2024-03-18 17:50:01,
be4b3f55-2e9d-49d3-be00-eebd1e79b9c2,Тимур Бабшанов,https://play-lh.googleusercontent.com/a/ACg8ocLcTnZ9JADjOb3iaFjVDIWTyhhRoz7rzmxgNfmppy0kCVGtHA=mo,Отличное,5,0,25.3,2024-03-15 09:25:25,,,25.3
a6e84ec0-b045-4e67-9c19-073ec1805076,1 Анастасия,https://play-lh.googleusercontent.com/a/ACg8ocKVBnwIYhMJv2m4u1xNSOgkXQLTHn2Y7Qobxgv54xKA_I1Hgg=mo,"Приложение вроде хорошее, нуопожалуйста сделайте чтобы можно было переключиться на тёмный экран",5,0,24.1,2024-02-12 11:03:18,"Спасибо большое за приятные слова! Ваше предложение записали, обязательно рассмотрим. Точных сроков реализации назвать не можем, но постараемся сделать всё как можно скорее!",2024-02-12 13:53:18,24.1
aec69340-88aa-47e9-a47e-2dfe47007391,Сальвадор Фрейташ,https://play-lh.googleusercontent.com/a-/ALV-UjVpPeipzY2vhhZcPxwVt4USzjjCX3T0hXR9PDqZkEa55jI9iYcl,Слишком маленькие буквы.нет возможности изменить шрифт,2,1,24.1,2024-01-25 16:18:54,"Спасибо за желание сделать Яндекс Разговор удобнее! Обязательно запишем ваше замечание и постараемся исправиться. Надеемся, будущие обновления вас порадуют!",2024-01-25 18:30:30,24.1
